[[38;2;255;0;0mjquery.min.js[0m] - using [target\jquery.min.js]
Gnuplot not found, using plotters backend
Benchmarking https://cdn.jsdelivr.net/npm/jquery@3.2.1/dist/jquery.min.js
Benchmarking https://cdn.jsdelivr.net/npm/jquery@3.2.1/dist/jquery.min.js: Warming up for 3.0000 s
Benchmarking https://cdn.jsdelivr.net/npm/jquery@3.2.1/dist/jquery.min.js: Collecting 100 samples in estimated 5.6923 s (600 iterations)
Benchmarking https://cdn.jsdelivr.net/npm/jquery@3.2.1/dist/jquery.min.js: Analyzing
https://cdn.jsdelivr.net/npm/jquery@3.2.1/dist/jquery.min.js
                        time:   [9.1073 ms 9.2227 ms 9.3573 ms]
                        change: [-2.6722% -0.5839% +1.4273%] (p = 0.59 > 0.05)
                        No change in performance detected.
Found 8 outliers among 100 measurements (8.00%)
  1 (1.00%) high mild
  7 (7.00%) high severe

Benchmark: https://cdn.jsdelivr.net/npm/jquery@3.2.1/dist/jquery.min.js
	Tokenization:   1.5989ms
	Parsing:        3.7801ms
	Tree_sink:      5.1346ms
	              ----------
	Total:         10.5136ms
	Diagnostics

[[38;2;255;0;0mvue.global.prod.js[0m] - using [target\vue.global.prod.js]
Benchmarking https://cdn.jsdelivr.net/npm/vue@3.2.22/dist/vue.global.prod.js
Benchmarking https://cdn.jsdelivr.net/npm/vue@3.2.22/dist/vue.global.prod.js: Warming up for 3.0000 s
Benchmarking https://cdn.jsdelivr.net/npm/vue@3.2.22/dist/vue.global.prod.js: Collecting 100 samples in estimated 5.8840 s (400 iterations)
Benchmarking https://cdn.jsdelivr.net/npm/vue@3.2.22/dist/vue.global.prod.js: Analyzing
https://cdn.jsdelivr.net/npm/vue@3.2.22/dist/vue.global.prod.js
                        time:   [14.483 ms 14.659 ms 14.872 ms]
                        change: [-2.3709% -0.7586% +0.8871%] (p = 0.38 > 0.05)
                        No change in performance detected.
Found 5 outliers among 100 measurements (5.00%)
  5 (5.00%) high severe

Benchmark: https://cdn.jsdelivr.net/npm/vue@3.2.22/dist/vue.global.prod.js
	Tokenization:   2.3289ms
	Parsing:         4.986ms
	Tree_sink:      8.1554ms
	              ----------
	Total:         15.4703ms
	Diagnostics

[[38;2;255;0;0mreact.production.min.js[0m] - using [target\react.production.min.js]
Benchmarking https://cdn.jsdelivr.net/npm/react@17.0.2/cjs/react.production.min.js
Benchmarking https://cdn.jsdelivr.net/npm/react@17.0.2/cjs/react.production.min.js: Warming up for 3.0000 s
Benchmarking https://cdn.jsdelivr.net/npm/react@17.0.2/cjs/react.production.min.js: Collecting 100 samples in estimated 5.5295 s (10k iterations)
Benchmarking https://cdn.jsdelivr.net/npm/react@17.0.2/cjs/react.production.min.js: Analyzing
https://cdn.jsdelivr.net/npm/react@17.0.2/cjs/react.production.min.js
                        time:   [546.18 us 547.33 us 548.68 us]
                        change: [-0.6852% -0.3622% -0.0357%] (p = 0.03 < 0.05)
                        Change within noise threshold.
Found 14 outliers among 100 measurements (14.00%)
  9 (9.00%) high mild
  5 (5.00%) high severe

Benchmark: https://cdn.jsdelivr.net/npm/react@17.0.2/cjs/react.production.min.js
	Tokenization:    108.4┬Ás
	Parsing:         322.6┬Ás
	Tree_sink:       447.2┬Ás
	              ----------
	Total:           878.2┬Ás
	Diagnostics

[[38;2;255;0;0mreact-dom.production.min.js[0m] - using [target\react-dom.production.min.js]
Benchmarking https://cdn.jsdelivr.net/npm/react-dom@17.0.2/cjs/react-dom.production.min.js
Benchmarking https://cdn.jsdelivr.net/npm/react-dom@17.0.2/cjs/react-dom.production.min.js: Warming up for 3.0000 s
Benchmarking https://cdn.jsdelivr.net/npm/react-dom@17.0.2/cjs/react-dom.production.min.js: Collecting 100 samples in estimated 5.9190 s (500 iterations)
Benchmarking https://cdn.jsdelivr.net/npm/react-dom@17.0.2/cjs/react-dom.production.min.js: Analyzing
https://cdn.jsdelivr.net/npm/react-dom@17.0.2/cjs/react-dom.production.min.js
                        time:   [11.663 ms 11.801 ms 11.965 ms]
                        change: [-1.8060% -0.0710% +1.6196%] (p = 0.93 > 0.05)
                        No change in performance detected.
Found 7 outliers among 100 measurements (7.00%)
  1 (1.00%) high mild
  6 (6.00%) high severe

Benchmark: https://cdn.jsdelivr.net/npm/react-dom@17.0.2/cjs/react-dom.production.min.js
	Tokenization:    1.819ms
	Parsing:        4.4235ms
	Tree_sink:      6.8128ms
	              ----------
	Total:         13.0553ms
	Diagnostics

[[38;2;255;0;0mcompiler.js[0m] - using [target\compiler.js]
Benchmarking https://cdn.jsdelivr.net/npm/svelte@3.44.2/compiler.js
Benchmarking https://cdn.jsdelivr.net/npm/svelte@3.44.2/compiler.js: Warming up for 3.0000 s

Warning: Unable to complete 100 samples in 5.0s. You may wish to increase target time to 5.2s, or reduce sample count to 90.
Benchmarking https://cdn.jsdelivr.net/npm/svelte@3.44.2/compiler.js: Collecting 100 samples in estimated 5.1633 s (100 iterations)
Benchmarking https://cdn.jsdelivr.net/npm/svelte@3.44.2/compiler.js: Analyzing
https://cdn.jsdelivr.net/npm/svelte@3.44.2/compiler.js
                        time:   [51.701 ms 52.589 ms 53.642 ms]
                        change: [-5.0273% -2.3708% +0.2891%] (p = 0.08 > 0.05)
                        No change in performance detected.
Found 7 outliers among 100 measurements (7.00%)
  2 (2.00%) high mild
  5 (5.00%) high severe

Benchmark: https://cdn.jsdelivr.net/npm/svelte@3.44.2/compiler.js
	Tokenization:   9.0849ms
	Parsing:        13.487ms
	Tree_sink:     29.1492ms
	              ----------
	Total:         51.7211ms
	Diagnostics

[[38;2;255;0;0mdojo.js[0m] - using [target\dojo.js]
Benchmarking https://cdn.jsdelivr.net/npm/dojo@1.16.4/dojo.js
Benchmarking https://cdn.jsdelivr.net/npm/dojo@1.16.4/dojo.js: Warming up for 3.0000 s
Benchmarking https://cdn.jsdelivr.net/npm/dojo@1.16.4/dojo.js: Collecting 100 samples in estimated 5.1757 s (2000 iterations)
Benchmarking https://cdn.jsdelivr.net/npm/dojo@1.16.4/dojo.js: Analyzing
https://cdn.jsdelivr.net/npm/dojo@1.16.4/dojo.js
                        time:   [2.5377 ms 2.5427 ms 2.5482 ms]
                        change: [-4.1294% -2.9515% -2.0189%] (p = 0.00 < 0.05)
                        Performance has improved.
Found 7 outliers among 100 measurements (7.00%)
  2 (2.00%) high mild
  5 (5.00%) high severe

Benchmark: https://cdn.jsdelivr.net/npm/dojo@1.16.4/dojo.js
	Tokenization:    479.2┬Ás
	Parsing:         933.3┬Ás
	Tree_sink:      2.0271ms
	              ----------
	Total:          3.4396ms
	Diagnostics

[[38;2;255;0;0md3.min.js[0m] - using [target\d3.min.js]
Benchmarking https://cdn.jsdelivr.net/npm/d3@7.1.1/dist/d3.min.js
Benchmarking https://cdn.jsdelivr.net/npm/d3@7.1.1/dist/d3.min.js: Warming up for 3.0000 s
Benchmarking https://cdn.jsdelivr.net/npm/d3@7.1.1/dist/d3.min.js: Collecting 100 samples in estimated 6.4000 s (200 iterations)
Benchmarking https://cdn.jsdelivr.net/npm/d3@7.1.1/dist/d3.min.js: Analyzing
https://cdn.jsdelivr.net/npm/d3@7.1.1/dist/d3.min.js
                        time:   [31.613 ms 32.062 ms 32.587 ms]
                        change: [-1.0081% +0.9309% +3.0474%] (p = 0.38 > 0.05)
                        No change in performance detected.
Found 10 outliers among 100 measurements (10.00%)
  1 (1.00%) high mild
  9 (9.00%) high severe

Benchmark: https://cdn.jsdelivr.net/npm/d3@7.1.1/dist/d3.min.js
	Tokenization:   4.6805ms
	Parsing:       10.4298ms
	Tree_sink:     18.3032ms
	              ----------
	Total:         33.4135ms
	Diagnostics
		Error: 3

[[38;2;255;0;0mpixi.min.js[0m] - using [target\pixi.min.js]
Benchmarking https://cdn.jsdelivr.net/npm/pixi.js@6.2.0/dist/browser/pixi.min.js
Benchmarking https://cdn.jsdelivr.net/npm/pixi.js@6.2.0/dist/browser/pixi.min.js: Warming up for 3.0000 s
Benchmarking https://cdn.jsdelivr.net/npm/pixi.js@6.2.0/dist/browser/pixi.min.js: Collecting 100 samples in estimated 8.0684 s (200 iterations)
Benchmarking https://cdn.jsdelivr.net/npm/pixi.js@6.2.0/dist/browser/pixi.min.js: Analyzing
https://cdn.jsdelivr.net/npm/pixi.js@6.2.0/dist/browser/pixi.min.js
                        time:   [39.824 ms 40.366 ms 40.988 ms]
                        change: [-1.8567% +0.2160% +2.4485%] (p = 0.84 > 0.05)
                        No change in performance detected.
Found 9 outliers among 100 measurements (9.00%)
  9 (9.00%) high severe

Benchmark: https://cdn.jsdelivr.net/npm/pixi.js@6.2.0/dist/browser/pixi.min.js
	Tokenization:   5.8858ms
	Parsing:       13.6416ms
	Tree_sink:     21.4525ms
	              ----------
	Total:         40.9799ms
	Diagnostics

[[38;2;255;0;0mthree.min.js[0m] - using [target\three.min.js]
Benchmarking https://cdn.jsdelivr.net/npm/three@0.134.0/build/three.min.js
Benchmarking https://cdn.jsdelivr.net/npm/three@0.134.0/build/three.min.js: Warming up for 3.0000 s
Benchmarking https://cdn.jsdelivr.net/npm/three@0.134.0/build/three.min.js: Collecting 100 samples in estimated 8.9651 s (200 iterations)
Benchmarking https://cdn.jsdelivr.net/npm/three@0.134.0/build/three.min.js: Analyzing
https://cdn.jsdelivr.net/npm/three@0.134.0/build/three.min.js
                        time:   [44.511 ms 45.117 ms 45.814 ms]
                        change: [-3.6516% -1.5404% +0.5810%] (p = 0.16 > 0.05)
                        No change in performance detected.
Found 12 outliers among 100 measurements (12.00%)
  3 (3.00%) high mild
  9 (9.00%) high severe

Benchmark: https://cdn.jsdelivr.net/npm/three@0.134.0/build/three.min.js
	Tokenization:   6.2852ms
	Parsing:       15.3023ms
	Tree_sink:     45.5214ms
	              ----------
	Total:         67.1089ms
	Diagnostics
		Error: 2

[[38;2;255;0;0mtex-chtml-full.js[0m] - using [target\tex-chtml-full.js]
Benchmarking https://cdn.jsdelivr.net/npm/mathjax@3.2.0/es5/tex-chtml-full.js
Benchmarking https://cdn.jsdelivr.net/npm/mathjax@3.2.0/es5/tex-chtml-full.js: Warming up for 3.0000 s

Warning: Unable to complete 100 samples in 5.0s. You may wish to increase target time to 8.4s, or reduce sample count to 50.
Benchmarking https://cdn.jsdelivr.net/npm/mathjax@3.2.0/es5/tex-chtml-full.js: Collecting 100 samples in estimated 8.4169 s (100 iterations)
Benchmarking https://cdn.jsdelivr.net/npm/mathjax@3.2.0/es5/tex-chtml-full.js: Analyzing
https://cdn.jsdelivr.net/npm/mathjax@3.2.0/es5/tex-chtml-full.js
                        time:   [83.407 ms 84.597 ms 85.957 ms]
                        change: [-3.8493% -1.6271% +0.4710%] (p = 0.15 > 0.05)
                        No change in performance detected.
Found 9 outliers among 100 measurements (9.00%)
  1 (1.00%) high mild
  8 (8.00%) high severe

Benchmark: https://cdn.jsdelivr.net/npm/mathjax@3.2.0/es5/tex-chtml-full.js
	Tokenization:  11.6447ms
	Parsing:       28.1118ms
	Tree_sink:     55.4154ms
	              ----------
	Total:         95.1719ms
	Diagnostics

Summary
-------
jquery.min.js,Total Time,10.5136ms,tokenization,1.5989ms,parsing,3.7801ms,tree_sink,5.1346ms
vue.global.prod.js,Total Time,15.4703ms,tokenization,2.3289ms,parsing,4.986ms,tree_sink,8.1554ms
react.production.min.js,Total Time,878.2┬Ás,tokenization,108.4┬Ás,parsing,322.6┬Ás,tree_sink,447.2┬Ás
react-dom.production.min.js,Total Time,13.0553ms,tokenization,1.819ms,parsing,4.4235ms,tree_sink,6.8128ms
compiler.js,Total Time,51.7211ms,tokenization,9.0849ms,parsing,13.487ms,tree_sink,29.1492ms
dojo.js,Total Time,3.4396ms,tokenization,479.2┬Ás,parsing,933.3┬Ás,tree_sink,2.0271ms
d3.min.js,Total Time,33.4135ms,tokenization,4.6805ms,parsing,10.4298ms,tree_sink,18.3032ms
pixi.min.js,Total Time,40.9799ms,tokenization,5.8858ms,parsing,13.6416ms,tree_sink,21.4525ms
three.min.js,Total Time,67.1089ms,tokenization,6.2852ms,parsing,15.3023ms,tree_sink,45.5214ms
tex-chtml-full.js,Total Time,95.1719ms,tokenization,11.6447ms,parsing,28.1118ms,tree_sink,55.4154ms
